{
  "handoff_id": "HANDOFF-GOLDEN-B2A-001",
  "type": "BUILDER_TO_AUDITOR",
  "version": "2.0.0",
  "source_role": "BUILDER",
  "target_role": "AUDITOR",
  "task_id": "TASK-EXAMPLE-REPAIR-001",
  "audit_run_id": null,
  "command_ref": "CMD-EXAMPLE-001",
  "target_repo": "goif74945-crypto/NEXY.AI-",
  "target_branch": "codex/spec-audit-20260919-78df350",
  "expected_head": "9c9befd9fe255b0f9271e6e2b8c4bb2443a08089",
  "observed_head": "9c9befd9fe255b0f9271e6e2b8c4bb2443a08089",
  "source_context_version": "AI-CONTEXT@P2-EXAMPLE",
  "finding_ids": [],
  "claims": [
    {
      "class": "NOT_VERIFIED",
      "statement": "Example package only; no real defect is asserted.",
      "evidence_refs": []
    }
  ],
  "proofs": [],
  "affected_requirements": [
    "REQ-EXAMPLE"
  ],
  "affected_entities": [
    "ENTITY-EXAMPLE"
  ],
  "affected_invariants": [
    "INV-EXAMPLE"
  ],
  "dependencies": [
    "DEP-EXAMPLE"
  ],
  "allowed_scope": [
    "example/path"
  ],
  "forbidden_scope": [
    "protected/path"
  ],
  "objectives": [
    "Repair only the proven example finding."
  ],
  "acceptance_criteria": [
    "Required tests pass at the resulting exact HEAD."
  ],
  "required_tests": [
    "focused-example-test"
  ],
  "negative_tests": [
    "out-of-scope mutation is rejected"
  ],
  "regression_tests": [
    "example-regression"
  ],
  "security_checks": [
    "scope boundary preserved"
  ],
  "expected_evidence": [
    "exact start/end HEAD",
    "executed test result"
  ],
  "rollback": [
    "Restore prior legal state if validation fails"
  ],
  "stop_conditions": [
    "expected HEAD mismatch",
    "authority conflict",
    "destructive operation without human approval"
  ],
  "supersedes": [],
  "start_head": "9c9befd9fe255b0f9271e6e2b8c4bb2443a08089",
  "end_head": "aaaaaaaaaaaaaaaaaaaaaaaaaaaaaaaaaaaaaaaa",
  "changed_files": [
    "example/path"
  ],
  "commits": [
    "aaaaaaaaaaaaaaaaaaaaaaaaaaaaaaaaaaaaaaaa"
  ],
  "actual_actions": [
    "Applied the authorized example repair only."
  ],
  "tests_run": [
    "focused-example-test",
    "example-regression"
  ],
  "test_results": [
    {
      "name": "focused-example-test",
      "status": "PASS",
      "evidence_refs": [
        "EVIDENCE-EXAMPLE-001"
      ]
    },
    {
      "name": "example-regression",
      "status": "PASS",
      "evidence_refs": [
        "EVIDENCE-EXAMPLE-002"
      ]
    }
  ],
  "evidence": [
    "EVIDENCE-EXAMPLE-001",
    "EVIDENCE-EXAMPLE-002"
  ],
  "failures": [],
  "residual_risks": [
    "Runtime/deployment remain NOT_VERIFIED in this example."
  ],
  "blockers": [],
  "rollback_state": "NOT_USED",
  "status": "DELIVERED",
  "resume": {
    "next_action": [
      "Auditor revalidates exact END_HEAD and evidence."
    ],
    "required_refresh": [
      "target HEAD",
      "evidence freshness"
    ],
    "context_refs": [
      "projects/NEXY.AI/handoff/INDEX.md"
    ]
  }
}
