{
  "handoff_id": "HANDOFF-NEXY-A2B-SEC-OTAC-LOG-001",
  "type": "AUDITOR_TO_BUILDER",
  "version": "1.0.0",
  "source_role": "AUDITOR",
  "target_role": "BUILDER",
  "task_id": "TASK-NEXY-SEC-OTAC-LOG-REPAIR-001",
  "audit_run_id": "AUDIT-NEXY-FULL-20260924-01",
  "command_ref": "projects/NEXY.AI/control-plane/live/commands/CMD-NEXY-SEC-OTAC-LOG-001.json",
  "target_repo": "goif74945-crypto/NEXY.AI-",
  "target_branch": "astra/omega-full-spec-convergence",
  "expected_head": "84484d8108fe1dee186450c0d36c26d360b2596e",
  "observed_head": "84484d8108fe1dee186450c0d36c26d360b2596e",
  "source_context_version": "00b364c6dce31c43db44b0bbcfa716af41bb8289",
  "finding_ids": [
    "F-NEXY-FULL-H-OTAC-LOG-001"
  ],
  "claims": [
    {
      "class": "SOURCE_FACT",
      "statement": "NEXY security requirements prohibit unnecessary plaintext secrets/PII in logs and require fail-closed handling.",
      "evidence_refs": [
        "F-NEXY-FULL-H-OTAC-LOG-001"
      ]
    },
    {
      "class": "REPO_FACT",
      "statement": "At target HEAD, packages/auth/email.ts ConsoleEmailProvider writes raw destination email and raw OTAC code to stderr and is selectable by EMAIL_PROVIDER=console or NODE_ENV=development.",
      "evidence_refs": [
        "goif74945-crypto/NEXY.AI-@84484d8108fe1dee186450c0d36c26d360b2596e:packages/auth/email.ts"
      ]
    }
  ],
  "proofs": [
    {
      "ref": "projects/NEXY.AI/audits/AUDIT-NEXY-FULL-20260924-01/findings.jsonl#F-NEXY-FULL-H-OTAC-LOG-001",
      "class": "SOURCE",
      "head": null
    },
    {
      "ref": "packages/auth/email.ts",
      "class": "E1_STATIC",
      "head": "84484d8108fe1dee186450c0d36c26d360b2596e"
    },
    {
      "ref": "tests/integration/auth/request-otac.spec.ts",
      "class": "E1_STATIC",
      "head": "84484d8108fe1dee186450c0d36c26d360b2596e"
    },
    {
      "ref": "tests/contract/auth-security-incident.test.ts",
      "class": "E1_STATIC",
      "head": "84484d8108fe1dee186450c0d36c26d360b2596e"
    }
  ],
  "affected_requirements": [
    "REQ-SEC-003"
  ],
  "affected_entities": [
    "SERVICE-OTAC",
    "MODULE-AUTH",
    "THREAT-SECRET-EXPOSURE"
  ],
  "affected_invariants": [],
  "dependencies": [],
  "allowed_scope": [
    "packages/auth/email.ts",
    "tests/contract/auth-email-provider.test.ts"
  ],
  "forbidden_scope": [
    "packages/api/auth.ts",
    "packages/auth/otac.ts",
    "packages/auth/security-incident.ts",
    "prisma/**",
    "evidence/**",
    "docs/**",
    "apps/**",
    "packages/queue/**",
    "packages/core/**"
  ],
  "objectives": [
    "Eliminate plaintext OTAC codes and destination email addresses from stdout/stderr/log output on every ConsoleEmailProvider/development path.",
    "Preserve SMTP OTAC delivery behavior.",
    "If console/development mode has no real secure delivery mechanism, fail closed with a non-sensitive error instead of reporting a successful OTAC delivery after logging or discarding the code."
  ],
  "acceptance_criteria": [
    "No execution path in packages/auth/email.ts writes, logs, throws, or otherwise exposes the raw OTAC code or raw destination email to stdout/stderr/log sinks.",
    "Console/development mode cannot report successful delivery unless the code is actually delivered through a non-log delivery mechanism; otherwise sendOtac rejects without embedding the email/code in the error.",
    "SMTP provider continues to send the OTAC to the destination through nodemailer and no HTTP-response behavior is changed by this command.",
    "A focused regression test uses sentinel email/code values and proves they do not appear in stdout/stderr or thrown error text.",
    "No files outside allowed_change_surface are modified."
  ],
  "required_tests": [
    "npm test -- tests/contract/auth-email-provider.test.ts",
    "npm run typecheck:backend",
    "npm run lint"
  ],
  "negative_tests": [
    "Set EMAIL_PROVIDER=console with sentinel email and OTAC; assert sentinel values are absent from captured stdout/stderr and rejection/error text.",
    "Set NODE_ENV=development without a secure delivery provider; assert sendOtac does not falsely resolve after dropping the code."
  ],
  "regression_tests": [
    "npm test -- tests/integration/auth/request-otac.spec.ts tests/contract/auth-security-incident.test.ts"
  ],
  "security_checks": [
    "Search the changed source/test diff for plaintext OTAC logging patterns and raw destination-email logging.",
    "Confirm no secret/credential values are added to fixtures, snapshots, evidence or error messages.",
    "Confirm auth/session/RBAC authority is unchanged."
  ],
  "expected_evidence": [
    "START_HEAD and END_HEAD",
    "exact changed-file list and diff",
    "focused negative test output proving raw email/code are absent from log/error capture",
    "request-otac and auth-security-incident regression results",
    "backend typecheck and lint results"
  ],
  "rollback": [
    "Revert only the command commit(s) if focused tests, typecheck, lint or security checks fail.",
    "Do not restore plaintext secret logging as an operational fallback."
  ],
  "stop_conditions": [
    "CURRENT_HEAD != expected_head",
    "Any required change appears to require a forbidden path",
    "A secret/credential is encountered in repository/tool output",
    "Required test would need weakening/deletion to pass",
    "The proposed fix would make OTAC delivery falsely succeed without secure delivery"
  ],
  "supersedes": [],
  "status": "READY",
  "resume": {
    "next_action": [
      "Refresh target branch HEAD and claim the READY command only if it still equals expected_head.",
      "Apply the smallest in-scope repair and execute all required/negative/regression/security checks.",
      "Return a BUILDER_TO_AUDITOR package; do not self-approve."
    ],
    "required_refresh": [
      "target branch HEAD",
      "AI-CONTEXT live queue/claims"
    ],
    "context_refs": [
      "projects/NEXY.AI/control-plane/live/commands/CMD-NEXY-SEC-OTAC-LOG-001.json",
      "projects/NEXY.AI/audits/AUDIT-NEXY-FULL-20260924-01/findings.jsonl"
    ]
  }
}
